{
  "acceptance_criteria": [
    "The REC-A story has verified implementation and delivery evidence."
  ],
  "approvals": [
    {
      "id": "APR-20261010043435-ec922c",
      "requirement_id": "REQ-REC-A",
      "status": "approved",
      "summary": "Approve REQ-REC-A",
      "scope": {
        "principle": "A human approval applies only to the specific artifact or decision shown to the user before the approval.",
        "subject_id": "REQ-REC-A",
        "subject_label": "requirement REQ-REC-A",
        "applies_only_to_presented_subject": true,
        "does_not_approve_future_artifacts": true,
        "requires_fresh_user_confirmation_for_new_artifacts": true,
        "approval_level": "requirement-and-autonomy-ceiling"
      },
      "evidence": [],
      "approval_source": "explicit-user",
      "authorization_ref": null,
      "authorization_use_ref": null,
      "authorization_action": null,
      "explicit_user_confirmation": true,
      "provisional": false,
      "approved_content_hash": "1b1c91c0f3488e7e9d6495338d4c2e9644968da899c211b553f3e16e5f48e47a",
      "hash_algorithm": "sha256:stable-json:v1",
      "approved_by": {
        "id": "antonioantenore",
        "type": "human",
        "name": "Merged Certification E2E",
        "email": "merged-certification-e2e@example.invalid",
        "source": "cli"
      },
      "git": {
        "is_git_repo": true,
        "branch": "codex/ST-REC-A",
        "head_sha": "ebc3276106881e24f31451fb8d3eae93766a7688",
        "is_dirty": true,
        "user": {
          "name": "Merged Certification E2E",
          "email": "merged-certification-e2e@example.invalid"
        },
        "remotes": [
          "origin"
        ]
      },
      "run": {
        "run_id": null,
        "thread_id": null,
        "session_id": null,
        "tool": "agentic-sdlc-cli",
        "version": "0.94.0"
      },
      "created_at": "2026-10-10T04:34:35.862Z"
    }
  ],
  "audit": {
    "created_by": {
      "email": null,
      "id": "codex",
      "name": "Codex",
      "source": "default",
      "type": "agent"
    },
    "git": {
      "is_git_repo": true,
      "branch": "codex/ST-REC-A",
      "head_sha": "ebc3276106881e24f31451fb8d3eae93766a7688",
      "is_dirty": true,
      "user": {
        "name": "Merged Certification E2E",
        "email": "merged-certification-e2e@example.invalid"
      },
      "remotes": [
        "origin"
      ]
    },
    "run": {
      "run_id": null,
      "thread_id": null,
      "session_id": null,
      "tool": "agentic-sdlc-cli",
      "version": "0.94.0"
    },
    "updated_by": {
      "id": "antonioantenore",
      "type": "human",
      "name": "Merged Certification E2E",
      "email": "merged-certification-e2e@example.invalid",
      "source": "cli"
    }
  },
  "autonomy_profile_id": "AUT-REQ-REC-A-R1",
  "constraints": [],
  "created_at": "2026-10-10T04:34:34.856Z",
  "derived_acceptance": [
    {
      "evidence_patterns": [],
      "id": "DV-unit-tests",
      "priority": "secondary",
      "rule_id": "unit-tests",
      "source": "derived",
      "text": "Automated tests cover the units and modules touched by this work and pass.",
      "verification_type": "automated_tests"
    },
    {
      "evidence_patterns": [
        "docs",
        "readme",
        "doc-test",
        "mdx",
        "markdown",
        "smoke",
        "demo"
      ],
      "id": "DV-docs-executable",
      "priority": "secondary",
      "rule_id": "docs-executable",
      "source": "derived",
      "text": "Every step documented or demonstrated by this work is executed as written and works.",
      "verification_type": "documentation_steps"
    }
  ],
  "derived_verification": {
    "covered_by_explicit": [],
    "disabled": false,
    "enforce": "block",
    "mode": "new",
    "policy_hash": "4c16c24fb4578039002b91b938e65459db9de327302471baa6e058973b0921e3",
    "reason": null,
    "schema_version": "derived-verification:v1",
    "scope": {
      "has_integrations": false,
      "write_paths": [
        "docs",
        "src"
      ]
    }
  },
  "id": "REQ-REC-A",
  "integrations": [],
  "kind": "requirement",
  "logical_id": "REQ-REC-A",
  "non_functional_requirements": [],
  "non_goals": [],
  "previous_revision_ref": null,
  "proposal_ref": null,
  "revision": 1,
  "schema_version": "requirement:v2",
  "source_hashes": {},
  "source_paths": [],
  "status": "approved",
  "summary": "Implement REC-A only inside its exact approved write scope.",
  "title": "Govern REC-A",
  "updated_at": "2026-10-10T04:34:35.868Z"
}
